[
  {
    "slug": "aws-certified-cloud-practitioner",
    "name": "AWS Certified Cloud Practitioner",
    "domain": "CS/IT",
    "issuer": "Amazon Web Services (AWS)",
    "url": "https://aws.amazon.com/certification/",
    "level": "Foundational",
    "exam_fee_usd": 100,
    "price_source": "official",
    "recommended_hours_min": 20,
    "recommended_hours_max": 40,
    "hours_source": "estimate",
    "validity_years": 3,
    "delivery": "online proctored or test center",
    "format": "multiple choice",
    "regions": "Global",
    "last_checked_utc": "2025-09-11T15:56:47.595752Z",
    "sources": [
      {
        "field": "exam_fee_usd",
        "type": "official",
        "url": "https://aws.amazon.com/certification/",
        "checked_at": "2025-09-11T15:56:47.596192Z"
      }
    ]
  },
  {
    "slug": "aws-certified-solutions-architect-associate",
    "name": "AWS Certified Solutions Architect – Associate",
    "domain": "CS/IT",
    "issuer": "Amazon Web Services (AWS)",
    "url": "https://aws.amazon.com/certification/",
    "level": "Associate",
    "exam_fee_usd": 150,
    "price_source": "official",
    "recommended_hours_min": 40,
    "recommended_hours_max": 80,
    "hours_source": "estimate",
    "validity_years": 3,
    "delivery": "online proctored or test center",
    "format": "multiple choice",
    "regions": "Global",
    "last_checked_utc": "2025-09-11T15:56:47.595752Z",
    "sources": [
      {
        "field": "exam_fee_usd",
        "type": "official",
        "url": "https://aws.amazon.com/certification/",
        "checked_at": "2025-09-11T15:56:47.596192Z"
      }
    ]
  },
  {
    "slug": "aws-certified-developer-associate",
    "name": "AWS Certified Developer – Associate",
    "domain": "CS/IT",
    "issuer": "Amazon Web Services (AWS)",
    "url": "https://aws.amazon.com/certification/",
    "level": "Associate",
    "exam_fee_usd": 150,
    "price_source": "official",
    "recommended_hours_min": 40,
    "recommended_hours_max": 80,
    "hours_source": "estimate",
    "validity_years": 3,
    "delivery": "online proctored or test center",
    "format": "multiple choice",
    "regions": "Global",
    "last_checked_utc": "2025-09-11T15:56:47.595752Z",
    "sources": [
      {
        "field": "exam_fee_usd",
        "type": "official",
        "url": "https://aws.amazon.com/certification/",
        "checked_at": "2025-09-11T15:56:47.596192Z"
      }
    ]
  },
  {
    "slug": "aws-certified-sysops-administrator-associate",
    "name": "AWS Certified SysOps Administrator – Associate",
    "domain": "CS/IT",
    "issuer": "Amazon Web Services (AWS)",
    "url": "https://aws.amazon.com/certification/",
    "level": "Associate",
    "exam_fee_usd": 150,
    "price_source": "official",
    "recommended_hours_min": 50,
    "recommended_hours_max": 90,
    "hours_source": "estimate",
    "validity_years": 3,
    "delivery": "online proctored or test center",
    "format": "multiple choice",
    "regions": "Global",
    "last_checked_utc": "2025-09-11T15:56:47.595752Z",
    "sources": [
      {
        "field": "exam_fee_usd",
        "type": "official",
        "url": "https://aws.amazon.com/certification/",
        "checked_at": "2025-09-11T15:56:47.596192Z"
      }
    ]
  },
  {
    "slug": "aws-certified-solutions-architect-professional",
    "name": "AWS Certified Solutions Architect – Professional",
    "domain": "CS/IT",
    "issuer": "Amazon Web Services (AWS)",
    "url": "https://aws.amazon.com/certification/",
    "level": "Professional",
    "exam_fee_usd": 300,
    "price_source": "official",
    "recommended_hours_min": 80,
    "recommended_hours_max": 120,
    "hours_source": "estimate",
    "validity_years": 3,
    "delivery": "online proctored or test center",
    "format": "multiple choice",
    "regions": "Global",
    "last_checked_utc": "2025-09-11T15:56:47.595752Z",
    "sources": [
      {
        "field": "exam_fee_usd",
        "type": "official",
        "url": "https://aws.amazon.com/certification/",
        "checked_at": "2025-09-11T15:56:47.596192Z"
      }
    ]
  },
  {
    "slug": "microsoft-azure-fundamentals",
    "name": "Microsoft Azure Fundamentals",
    "domain": "CS/IT",
    "issuer": "Microsoft",
    "url": "https://learn.microsoft.com/en-us/certifications/",
    "level": "Foundational",
    "exam_fee_usd": 99,
    "price_source": "official",
    "recommended_hours_min": 15,
    "recommended_hours_max": 30,
    "hours_source": "estimate",
    "validity_years": 2,
    "delivery": "online proctored or test center",
    "format": "multiple choice",
    "regions": "Global",
    "last_checked_utc": "2025-09-11T15:56:47.595752Z",
    "sources": [
      {
        "field": "exam_fee_usd",
        "type": "official",
        "url": "https://learn.microsoft.com/en-us/certifications/",
        "checked_at": "2025-09-11T15:56:47.596192Z"
      }
    ]
  },
  {
    "slug": "microsoft-azure-administrator-associate",
    "name": "Microsoft Azure Administrator Associate",
    "domain": "CS/IT",
    "issuer": "Microsoft",
    "url": "https://learn.microsoft.com/en-us/certifications/",
    "level": "Associate",
    "exam_fee_usd": 165,
    "price_source": "official",
    "recommended_hours_min": 40,
    "recommended_hours_max": 70,
    "hours_source": "estimate",
    "validity_years": 2,
    "delivery": "online proctored or test center",
    "format": "multiple choice",
    "regions": "Global",
    "last_checked_utc": "2025-09-11T15:56:47.595752Z",
    "sources": [
      {
        "field": "exam_fee_usd",
        "type": "official",
        "url": "https://learn.microsoft.com/en-us/certifications/",
        "checked_at": "2025-09-11T15:56:47.596192Z"
      }
    ]
  },
  {
    "slug": "microsoft-azure-solutions-architect-expert",
    "name": "Microsoft Azure Solutions Architect Expert",
    "domain": "CS/IT",
    "issuer": "Microsoft",
    "url": "https://learn.microsoft.com/en-us/certifications/",
    "level": "Expert",
    "exam_fee_usd": 165,
    "price_source": "official",
    "recommended_hours_min": 80,
    "recommended_hours_max": 120,
    "hours_source": "estimate",
    "validity_years": 2,
    "delivery": "online proctored or test center",
    "format": "multiple choice",
    "regions": "Global",
    "last_checked_utc": "2025-09-11T15:56:47.595752Z",
    "sources": [
      {
        "field": "exam_fee_usd",
        "type": "official",
        "url": "https://learn.microsoft.com/en-us/certifications/",
        "checked_at": "2025-09-11T15:56:47.596192Z"
      }
    ]
  },
  {
    "slug": "google-cloud-digital-leader",
    "name": "Google Cloud Digital Leader",
    "domain": "CS/IT",
    "issuer": "Google Cloud",
    "url": "https://cloud.google.com/certification",
    "level": "Foundational",
    "exam_fee_usd": 99,
    "price_source": "official",
    "recommended_hours_min": 20,
    "recommended_hours_max": 40,
    "hours_source": "estimate",
    "validity_years": 2,
    "delivery": "online proctored or test center",
    "format": "multiple choice",
    "regions": "Global",
    "last_checked_utc": "2025-09-11T15:56:47.595752Z",
    "sources": [
      {
        "field": "exam_fee_usd",
        "type": "official",
        "url": "https://cloud.google.com/certification",
        "checked_at": "2025-09-11T15:56:47.596192Z"
      }
    ]
  },
  {
    "slug": "google-cloud-professional-cloud-architect",
    "name": "Google Cloud Professional Cloud Architect",
    "domain": "CS/IT",
    "issuer": "Google Cloud",
    "url": "https://cloud.google.com/certification",
    "level": "Professional",
    "exam_fee_usd": 200,
    "price_source": "official",
    "recommended_hours_min": 60,
    "recommended_hours_max": 100,
    "hours_source": "estimate",
    "validity_years": 2,
    "delivery": "online proctored or test center",
    "format": "multiple choice",
    "regions": "Global",
    "last_checked_utc": "2025-09-11T15:56:47.595752Z",
    "sources": [
      {
        "field": "exam_fee_usd",
        "type": "official",
        "url": "https://cloud.google.com/certification",
        "checked_at": "2025-09-11T15:56:47.596192Z"
      }
    ]
  },
  {
    "slug": "google-cloud-professional-data-engineer",
    "name": "Google Cloud Professional Data Engineer",
    "domain": "CS/IT",
    "issuer": "Google Cloud",
    "url": "https://cloud.google.com/certification",
    "level": "Professional",
    "exam_fee_usd": 200,
    "price_source": "official",
    "recommended_hours_min": 60,
    "recommended_hours_max": 100,
    "hours_source": "estimate",
    "validity_years": 2,
    "delivery": "online proctored or test center",
    "format": "multiple choice",
    "regions": "Global",
    "last_checked_utc": "2025-09-11T15:56:47.595752Z",
    "sources": [
      {
        "field": "exam_fee_usd",
        "type": "official",
        "url": "https://cloud.google.com/certification",
        "checked_at": "2025-09-11T15:56:47.596192Z"
      }
    ]
  },
  {
    "slug": "comptia-security",
    "name": "CompTIA Security+",
    "domain": "CS/IT",
    "issuer": "CompTIA",
    "url": "https://www.comptia.org/certifications",
    "level": "Associate",
    "exam_fee_usd": 370,
    "price_source": "official",
    "recommended_hours_min": 40,
    "recommended_hours_max": 80,
    "hours_source": "estimate",
    "validity_years": 3,
    "delivery": "test center",
    "format": "multiple choice",
    "regions": "Global",
    "last_checked_utc": "2025-09-11T15:56:47.595752Z",
    "sources": [
      {
        "field": "exam_fee_usd",
        "type": "official",
        "url": "https://www.comptia.org/certifications",
        "checked_at": "2025-09-11T15:56:47.596192Z"
      }
    ]
  },
  {
    "slug": "comptia-network",
    "name": "CompTIA Network+",
    "domain": "CS/IT",
    "issuer": "CompTIA",
    "url": "https://www.comptia.org/certifications",
    "level": "Associate",
    "exam_fee_usd": 358,
    "price_source": "official",
    "recommended_hours_min": 50,